[
  {
    "id": "kb_001",
    "name": "MX Keys Mini 무선 기계식 키보드",
    "url": "https://example.com/products/mx-keys-mini",
    "category": "keyboard",
    "price": 139000,
    "description": "콤팩트한 텐키리스 디자인의 최고급 무선 기계식 키보드. 스마트 백라이트와 이지스위치 탑재.",
    "images": [
      "https://example.com/images/mx-keys-mini-1.jpg"
    ],
    "reviews": [
      "키감이 아주 쫀득하고 칠 때 기분이 좋습니다.",
      "멀티페어링 전환이 정말 빠르고 무선이라 선이 없어 책상이 깔끔합니다.",
      "배터리가 엄청 오래가서 충전을 자주 안 해도 되니 편리해요.",
      "기계식이라 그런지 약간 묵직해서 휴대용으로는 무거운 편입니다."
    ]
  },
  {
    "id": "pad_001",
    "name": "프리미엄 펠트 데스크 매트 L",
    "url": "https://example.com/products/felt-desk-mat",
    "category": "desk-accessory",
    "price": 24900,
    "description": "따뜻하고 고급스러운 느낌의 양모 펠트 데스크 매트. 논슬립 패드로 밀림 방지.",
    "images": [
      "https://example.com/images/felt-mat-1.jpg"
    ],
    "reviews": [
      "책상 분위기가 따뜻해지고 엄청 깔끔하게 정리됩니다.",
      "펠트 재질이라 키보드 소음을 흡수해줘서 차분하게 타건하기 좋습니다.",
      "처음 꺼냈을 때 양모 특유의 냄새가 나고, 맨살이 닿으면 살짝 까끌거리는 단점이 있습니다."
    ]
  },
  {
    "id": "ms_001",
    "name": "MX Master 3S 에르고노믹 무선 마우스",
    "url": "https://example.com/products/mx-master-3s",
    "category": "mouse",
    "price": 149000,
    "description": "손목이 편안한 인체공학적 디자인과 초고속 MagSpeed 휠이 탑재된 무소음 마우스.",
    "images": [
      "https://example.com/images/mx-master-3s-1.jpg"
    ],
    "reviews": [
      "장시간 마우스를 쥐어도 손목 통증이 확실히 줄어들고 진짜 편합니다.",
      "클릭음이 거의 안 나는 무소음이라 조용한 사무실이나 카페에서 쓰기 최적입니다.",
      "스크롤 휠 속도가 신세계예요. 길고 많은 코드나 웹문서 볼 때 최고의 생산성을 줍니다.",
      "마우스가 다소 무거운 편이고, 손이 작으신 분들에게는 쥐었을 때 다소 크다고 느낄 수 있습니다."
    ]
  }
]
